{
  "schemaVersion": "1.0.0",
  "generatedAt": "1970-01-01T00:00:00.000Z",
  "source": "aha_music",
  "artists": [],
  "tracks": [],
  "places": [],
  "relations": [],
  "canon": [
    {
      "canonNodeId": "afrobeat",
      "name": "Afrobeat",
      "type": "genre",
      "shortDescription": "West African popular music combining groove, horns, extended forms and political expression.",
      "linkedArtistIds": [],
      "linkedTrackIds": [],
      "linkedPlaylistIds": []
    },
    {
      "canonNodeId": "ambient",
      "name": "Ambient",
      "type": "genre",
      "shortDescription": "Music focused on atmosphere, texture, space and sustained listening environments.",
      "linkedArtistIds": [],
      "linkedTrackIds": [],
      "linkedPlaylistIds": []
    },
    {
      "canonNodeId": "ancient_music",
      "name": "Ancient music",
      "type": "era",
      "shortDescription": "Historical music era used as a high-level timeline anchor for ancient music.",
      "linkedArtistIds": [],
      "linkedTrackIds": [],
      "linkedPlaylistIds": []
    },
    {
      "canonNodeId": "baroque",
      "name": "Baroque",
      "type": "era",
      "shortDescription": "Historical music era used as a high-level timeline anchor for baroque.",
      "linkedArtistIds": [],
      "linkedTrackIds": [],
      "linkedPlaylistIds": []
    },
    {
      "canonNodeId": "black_atlantic_music",
      "name": "Black Atlantic music",
      "type": "cultural_context",
      "shortDescription": "Transatlantic Black musical continuum linking African diasporic histories and modern popular forms.",
      "linkedArtistIds": [],
      "linkedTrackIds": [],
      "linkedPlaylistIds": []
    },
    {
      "canonNodeId": "blues",
      "name": "Blues",
      "type": "genre",
      "shortDescription": "African American musical form centered on expressive vocal style, blue notes and repeated harmonic patterns.",
      "linkedArtistIds": [],
      "linkedTrackIds": [],
      "linkedPlaylistIds": []
    },
    {
      "canonNodeId": "call_and_response",
      "name": "Call and response",
      "type": "music_theory",
      "shortDescription": "Responsive musical structure where one phrase is answered by another.",
      "linkedArtistIds": [],
      "linkedTrackIds": [],
      "linkedPlaylistIds": []
    },
    {
      "canonNodeId": "classical_period",
      "name": "Classical period",
      "type": "era",
      "shortDescription": "Historical music era used as a high-level timeline anchor for classical period.",
      "linkedArtistIds": [],
      "linkedTrackIds": [],
      "linkedPlaylistIds": []
    },
    {
      "canonNodeId": "club_culture",
      "name": "Club culture",
      "type": "cultural_context",
      "shortDescription": "Nightlife and DJ-centered spaces where dance music scenes, taste and technology develop.",
      "linkedArtistIds": [],
      "linkedTrackIds": [],
      "linkedPlaylistIds": []
    },
    {
      "canonNodeId": "country",
      "name": "Country",
      "type": "genre",
      "shortDescription": "Popular music tradition drawing on folk ballads, rural storytelling and string-band practices.",
      "linkedArtistIds": [],
      "linkedTrackIds": [],
      "linkedPlaylistIds": []
    },
    {
      "canonNodeId": "dance_culture",
      "name": "Dance culture",
      "type": "cultural_context",
      "shortDescription": "Social contexts where music is organized around dancing, bodies and shared movement.",
      "linkedArtistIds": [],
      "linkedTrackIds": [],
      "linkedPlaylistIds": []
    },
    {
      "canonNodeId": "dancehall",
      "name": "Dancehall",
      "type": "genre",
      "shortDescription": "Jamaican music culture emphasizing deejay vocals, digital riddims and sound-system performance.",
      "linkedArtistIds": [],
      "linkedTrackIds": [],
      "linkedPlaylistIds": []
    },
    {
      "canonNodeId": "digital_music_age",
      "name": "Digital music age",
      "type": "era",
      "shortDescription": "Historical music era used as a high-level timeline anchor for digital music age.",
      "linkedArtistIds": [],
      "linkedTrackIds": [],
      "linkedPlaylistIds": []
    },
    {
      "canonNodeId": "disco",
      "name": "Disco",
      "type": "genre",
      "shortDescription": "Dance music culture and production style built around steady pulse, orchestration and club playback.",
      "linkedArtistIds": [],
      "linkedTrackIds": [],
      "linkedPlaylistIds": []
    },
    {
      "canonNodeId": "distortion",
      "name": "Distortion",
      "type": "production",
      "shortDescription": "Sound alteration caused by saturation, clipping or nonlinear amplification.",
      "linkedArtistIds": [],
      "linkedTrackIds": [],
      "linkedPlaylistIds": []
    },
    {
      "canonNodeId": "drone",
      "name": "Drone",
      "type": "music_theory",
      "shortDescription": "Sustained or repeated pitch foundation used as a tonal reference.",
      "linkedArtistIds": [],
      "linkedTrackIds": [],
      "linkedPlaylistIds": []
    },
    {
      "canonNodeId": "drum_machine",
      "name": "Drum machine",
      "type": "instrument",
      "shortDescription": "Electronic instrument for sequencing and playing percussion sounds.",
      "linkedArtistIds": [],
      "linkedTrackIds": [],
      "linkedPlaylistIds": []
    },
    {
      "canonNodeId": "dub",
      "name": "Dub",
      "type": "genre",
      "shortDescription": "Studio-centered Jamaican practice using remixing, echo, reverb, bass and instrumental versions.",
      "linkedArtistIds": [],
      "linkedTrackIds": [],
      "linkedPlaylistIds": []
    },
    {
      "canonNodeId": "electronic_music",
      "name": "Electronic music",
      "type": "genre",
      "shortDescription": "Music made with electronic sound generation, processing, sequencing or computer-based production.",
      "linkedArtistIds": [],
      "linkedTrackIds": [],
      "linkedPlaylistIds": []
    },
    {
      "canonNodeId": "film_music",
      "name": "Film music",
      "type": "genre",
      "shortDescription": "Music composed, selected or produced to support cinematic narrative, mood and audiovisual timing.",
      "linkedArtistIds": [],
      "linkedTrackIds": [],
      "linkedPlaylistIds": []
    },
    {
      "canonNodeId": "folk_music",
      "name": "Folk music",
      "type": "tradition",
      "shortDescription": "Community-based music traditions transmitted through local practice and memory.",
      "linkedArtistIds": [],
      "linkedTrackIds": [],
      "linkedPlaylistIds": []
    },
    {
      "canonNodeId": "funk",
      "name": "Funk",
      "type": "genre",
      "shortDescription": "Groove-driven music emphasizing syncopated bass, drums, riffs and collective rhythmic interlock.",
      "linkedArtistIds": [],
      "linkedTrackIds": [],
      "linkedPlaylistIds": []
    },
    {
      "canonNodeId": "game_music",
      "name": "Game music",
      "type": "genre",
      "shortDescription": "Interactive and linear music created for video games, gameplay states and digital worlds.",
      "linkedArtistIds": [],
      "linkedTrackIds": [],
      "linkedPlaylistIds": []
    },
    {
      "canonNodeId": "gospel",
      "name": "Gospel",
      "type": "genre",
      "shortDescription": "Sacred vocal tradition rooted in Christian worship, communal singing and expressive call-and-response.",
      "linkedArtistIds": [],
      "linkedTrackIds": [],
      "linkedPlaylistIds": []
    },
    {
      "canonNodeId": "groove",
      "name": "Groove",
      "type": "rhythm",
      "shortDescription": "Felt rhythmic momentum created by repeated patterns, timing and ensemble interaction.",
      "linkedArtistIds": [],
      "linkedTrackIds": [],
      "linkedPlaylistIds": []
    },
    {
      "canonNodeId": "harmony",
      "name": "Harmony",
      "type": "harmony",
      "shortDescription": "Combination and progression of pitches or chords sounding together.",
      "linkedArtistIds": [],
      "linkedTrackIds": [],
      "linkedPlaylistIds": []
    },
    {
      "canonNodeId": "hip_hop",
      "name": "Hip hop",
      "type": "genre",
      "shortDescription": "Cultural and musical form built around MCing, DJing, beats, sampling and urban expression.",
      "linkedArtistIds": [],
      "linkedTrackIds": [],
      "linkedPlaylistIds": []
    },
    {
      "canonNodeId": "house",
      "name": "House",
      "type": "genre",
      "shortDescription": "Electronic dance music developed around four-on-the-floor rhythms, DJs, drum machines and clubs.",
      "linkedArtistIds": [],
      "linkedTrackIds": [],
      "linkedPlaylistIds": []
    },
    {
      "canonNodeId": "improvisation",
      "name": "Improvisation",
      "type": "music_theory",
      "shortDescription": "Real-time musical creation within stylistic, social or formal constraints.",
      "linkedArtistIds": [],
      "linkedTrackIds": [],
      "linkedPlaylistIds": []
    },
    {
      "canonNodeId": "internet_music_culture",
      "name": "Internet music culture",
      "type": "cultural_context",
      "shortDescription": "Networked music circulation shaped by platforms, memes, communities and digital release practices.",
      "linkedArtistIds": [],
      "linkedTrackIds": [],
      "linkedPlaylistIds": []
    },
    {
      "canonNodeId": "jazz",
      "name": "Jazz",
      "type": "genre",
      "shortDescription": "Improvisatory music tradition shaped by swing, blues, ensemble interaction and harmonic exploration.",
      "linkedArtistIds": [],
      "linkedTrackIds": [],
      "linkedPlaylistIds": []
    },
    {
      "canonNodeId": "latin_music",
      "name": "Latin music",
      "type": "tradition",
      "shortDescription": "Broad set of Latin American and diasporic musical traditions, rhythms and popular forms.",
      "linkedArtistIds": [],
      "linkedTrackIds": [],
      "linkedPlaylistIds": []
    },
    {
      "canonNodeId": "loop",
      "name": "Loop",